{
  "contract_family": "rid-calendar",
  "contract_version": 1,
  "vector_kind": "irrigation-week",
  "vectors": [
    {
      "date": "1900-11-01",
      "irrigation_year": { "ce": 1901, "be": 2444 },
      "irrigation_week": 1,
      "week_key": "1901-R01",
      "week_start": "1900-11-01",
      "week_end": "1900-11-07",
      "week_length_days": 7,
      "iso_week": 44,
      "iso_year": 1900,
      "note": "first supported irrigation year begins"
    },
    {
      "date": "2023-11-01",
      "irrigation_year": { "ce": 2024, "be": 2567 },
      "irrigation_week": 1,
      "week_key": "2024-R01",
      "week_start": "2023-11-01",
      "week_end": "2023-11-07",
      "week_length_days": 7,
      "iso_week": 44,
      "iso_year": 2023,
      "note": "anchor: irrigation year 2024 week 1 begins, a Wednesday"
    },
    {
      "date": "2023-11-07",
      "irrigation_year": { "ce": 2024, "be": 2567 },
      "irrigation_week": 1,
      "week_key": "2024-R01",
      "week_start": "2023-11-01",
      "week_end": "2023-11-07",
      "week_length_days": 7,
      "iso_week": 45,
      "iso_year": 2023,
      "note": "irrigation year 2024 week 1 final day"
    },
    {
      "date": "2023-11-08",
      "irrigation_year": { "ce": 2024, "be": 2567 },
      "irrigation_week": 2,
      "week_key": "2024-R02",
      "week_start": "2023-11-08",
      "week_end": "2023-11-14",
      "week_length_days": 7,
      "iso_week": 45,
      "iso_year": 2023,
      "note": "irrigation year 2024 week 2 first day"
    },
    {
      "date": "2024-02-29",
      "irrigation_year": { "ce": 2024, "be": 2567 },
      "irrigation_week": 18,
      "week_key": "2024-R18",
      "week_start": "2024-02-28",
      "week_end": "2024-03-05",
      "week_length_days": 7,
      "iso_week": 9,
      "iso_year": 2024,
      "note": "leap day inside the irrigation year 2024 span"
    },
    {
      "date": "2024-10-29",
      "irrigation_year": { "ce": 2024, "be": 2567 },
      "irrigation_week": 52,
      "week_key": "2024-R52",
      "week_start": "2024-10-23",
      "week_end": "2024-10-29",
      "week_length_days": 7,
      "iso_week": 44,
      "iso_year": 2024,
      "note": "irrigation year 2024 week 52 final day (last full week)"
    },
    {
      "date": "2024-10-30",
      "irrigation_year": { "ce": 2024, "be": 2567 },
      "irrigation_week": 53,
      "week_key": "2024-R53",
      "week_start": "2024-10-30",
      "week_end": "2024-10-31",
      "week_length_days": 2,
      "iso_week": 44,
      "iso_year": 2024,
      "note": "irrigation year 2024 week 53 first day"
    },
    {
      "date": "2024-10-31",
      "irrigation_year": { "ce": 2024, "be": 2567 },
      "irrigation_week": 53,
      "week_key": "2024-R53",
      "week_start": "2024-10-30",
      "week_end": "2024-10-31",
      "week_length_days": 2,
      "iso_week": 44,
      "iso_year": 2024,
      "note": "irrigation year 2024 span ends; week 53 is 2 days (leap)"
    },
    {
      "date": "2024-11-01",
      "irrigation_year": { "ce": 2025, "be": 2568 },
      "irrigation_week": 1,
      "week_key": "2025-R01",
      "week_start": "2024-11-01",
      "week_end": "2024-11-07",
      "week_length_days": 7,
      "iso_week": 44,
      "iso_year": 2024,
      "note": "anchor: irrigation year 2025 week 1 begins, a Friday"
    },
    {
      "date": "2024-11-07",
      "irrigation_year": { "ce": 2025, "be": 2568 },
      "irrigation_week": 1,
      "week_key": "2025-R01",
      "week_start": "2024-11-01",
      "week_end": "2024-11-07",
      "week_length_days": 7,
      "iso_week": 45,
      "iso_year": 2024,
      "note": "irrigation year 2025 week 1 final day"
    },
    {
      "date": "2024-11-08",
      "irrigation_year": { "ce": 2025, "be": 2568 },
      "irrigation_week": 2,
      "week_key": "2025-R02",
      "week_start": "2024-11-08",
      "week_end": "2024-11-14",
      "week_length_days": 7,
      "iso_week": 45,
      "iso_year": 2024,
      "note": "irrigation year 2025 week 2 first day"
    },
    {
      "date": "2025-10-30",
      "irrigation_year": { "ce": 2025, "be": 2568 },
      "irrigation_week": 52,
      "week_key": "2025-R52",
      "week_start": "2025-10-24",
      "week_end": "2025-10-30",
      "week_length_days": 7,
      "iso_week": 44,
      "iso_year": 2025,
      "note": "irrigation year 2025 week 52 final day (last full week)"
    },
    {
      "date": "2025-10-31",
      "irrigation_year": { "ce": 2025, "be": 2568 },
      "irrigation_week": 53,
      "week_key": "2025-R53",
      "week_start": "2025-10-31",
      "week_end": "2025-10-31",
      "week_length_days": 1,
      "iso_week": 44,
      "iso_year": 2025,
      "note": "irrigation year 2025 span ends; week 53 is 1 day"
    },
    {
      "date": "2025-11-01",
      "irrigation_year": { "ce": 2026, "be": 2569 },
      "irrigation_week": 1,
      "week_key": "2026-R01",
      "week_start": "2025-11-01",
      "week_end": "2025-11-07",
      "week_length_days": 7,
      "iso_week": 44,
      "iso_year": 2025,
      "note": "anchor: irrigation year 2026 week 1 begins, a Saturday"
    },
    {
      "date": "2025-11-07",
      "irrigation_year": { "ce": 2026, "be": 2569 },
      "irrigation_week": 1,
      "week_key": "2026-R01",
      "week_start": "2025-11-01",
      "week_end": "2025-11-07",
      "week_length_days": 7,
      "iso_week": 45,
      "iso_year": 2025,
      "note": "irrigation year 2026 week 1 final day"
    },
    {
      "date": "2025-11-08",
      "irrigation_year": { "ce": 2026, "be": 2569 },
      "irrigation_week": 2,
      "week_key": "2026-R02",
      "week_start": "2025-11-08",
      "week_end": "2025-11-14",
      "week_length_days": 7,
      "iso_week": 45,
      "iso_year": 2025,
      "note": "irrigation year 2026 week 2 first day"
    },
    {
      "date": "2026-01-01",
      "irrigation_year": { "ce": 2026, "be": 2569 },
      "irrigation_week": 9,
      "week_key": "2026-R09",
      "week_start": "2025-12-27",
      "week_end": "2026-01-02",
      "week_length_days": 7,
      "iso_week": 1,
      "iso_year": 2026,
      "note": "New Year's Day: ISO week 1, irrigation year 2026 week 9"
    },
    {
      "date": "2026-10-30",
      "irrigation_year": { "ce": 2026, "be": 2569 },
      "irrigation_week": 52,
      "week_key": "2026-R52",
      "week_start": "2026-10-24",
      "week_end": "2026-10-30",
      "week_length_days": 7,
      "iso_week": 44,
      "iso_year": 2026,
      "note": "irrigation year 2026 week 52 final day (last full week)"
    },
    {
      "date": "2026-10-31",
      "irrigation_year": { "ce": 2026, "be": 2569 },
      "irrigation_week": 53,
      "week_key": "2026-R53",
      "week_start": "2026-10-31",
      "week_end": "2026-10-31",
      "week_length_days": 1,
      "iso_week": 44,
      "iso_year": 2026,
      "note": "irrigation year 2026 span ends; week 53 is 1 day"
    },
    {
      "date": "2026-11-01",
      "irrigation_year": { "ce": 2027, "be": 2570 },
      "irrigation_week": 1,
      "week_key": "2027-R01",
      "week_start": "2026-11-01",
      "week_end": "2026-11-07",
      "week_length_days": 7,
      "iso_week": 44,
      "iso_year": 2026,
      "note": "anchor: irrigation year 2027 week 1 begins, a Sunday"
    },
    {
      "date": "2026-11-07",
      "irrigation_year": { "ce": 2027, "be": 2570 },
      "irrigation_week": 1,
      "week_key": "2027-R01",
      "week_start": "2026-11-01",
      "week_end": "2026-11-07",
      "week_length_days": 7,
      "iso_week": 45,
      "iso_year": 2026,
      "note": "irrigation year 2027 week 1 final day"
    },
    {
      "date": "2026-11-08",
      "irrigation_year": { "ce": 2027, "be": 2570 },
      "irrigation_week": 2,
      "week_key": "2027-R02",
      "week_start": "2026-11-08",
      "week_end": "2026-11-14",
      "week_length_days": 7,
      "iso_week": 45,
      "iso_year": 2026,
      "note": "irrigation year 2027 week 2 first day"
    },
    {
      "date": "2026-12-28",
      "irrigation_year": { "ce": 2027, "be": 2570 },
      "irrigation_week": 9,
      "week_key": "2027-R09",
      "week_start": "2026-12-27",
      "week_end": "2027-01-02",
      "week_length_days": 7,
      "iso_week": 53,
      "iso_year": 2026,
      "note": "ISO week 53 of 2026, but irrigation year 2027 week 9"
    },
    {
      "date": "2027-01-01",
      "irrigation_year": { "ce": 2027, "be": 2570 },
      "irrigation_week": 9,
      "week_key": "2027-R09",
      "week_start": "2026-12-27",
      "week_end": "2027-01-02",
      "week_length_days": 7,
      "iso_week": 53,
      "iso_year": 2026,
      "note": "ISO week 53 of 2026, but irrigation year 2027 week 9"
    },
    {
      "date": "2027-10-30",
      "irrigation_year": { "ce": 2027, "be": 2570 },
      "irrigation_week": 52,
      "week_key": "2027-R52",
      "week_start": "2027-10-24",
      "week_end": "2027-10-30",
      "week_length_days": 7,
      "iso_week": 43,
      "iso_year": 2027,
      "note": "irrigation year 2027 week 52 final day (last full week)"
    },
    {
      "date": "2027-10-31",
      "irrigation_year": { "ce": 2027, "be": 2570 },
      "irrigation_week": 53,
      "week_key": "2027-R53",
      "week_start": "2027-10-31",
      "week_end": "2027-10-31",
      "week_length_days": 1,
      "iso_week": 43,
      "iso_year": 2027,
      "note": "irrigation year 2027 span ends; week 53 is 1 day"
    },
    {
      "date": "2027-11-01",
      "irrigation_year": { "ce": 2028, "be": 2571 },
      "irrigation_week": 1,
      "week_key": "2028-R01",
      "week_start": "2027-11-01",
      "week_end": "2027-11-07",
      "week_length_days": 7,
      "iso_week": 44,
      "iso_year": 2027,
      "note": "anchor: irrigation year 2028 week 1 begins, a Monday"
    },
    {
      "date": "2027-11-07",
      "irrigation_year": { "ce": 2028, "be": 2571 },
      "irrigation_week": 1,
      "week_key": "2028-R01",
      "week_start": "2027-11-01",
      "week_end": "2027-11-07",
      "week_length_days": 7,